{
  "$schema": "https://raw.githubusercontent.com/kewe87/casehud-library/main/schema/component.schema.json",
  "format": 1,
  "id": "universal-screen-8-8",
  "vendor": "Lian Li",
  "model": "Universal Screen 8.8\"",
  "part_numbers": [
    "G89.SM088X.00",
    "SM088X",
    "SM088W"
  ],
  "category": "display",
  "dimensions_mm": {
    "w": 237,
    "h": 73,
    "d": 13
  },
  "outline": {
    "front": [
      {
        "type": "rect",
        "x": 0,
        "y": 0,
        "w": 237,
        "h": 73,
        "r": 6,
        "role": "body"
      },
      {
        "type": "rect",
        "x": 10.1,
        "y": 9.4,
        "w": 216.8,
        "h": 54.2,
        "r": 1,
        "role": "display"
      },
      {
        "type": "rect",
        "x": 2.5,
        "y": 2.5,
        "w": 232,
        "h": 68,
        "r": 5,
        "role": "lit"
      }
    ],
    "approximate": true
  },
  "leds": {
    "count": 60,
    "positions_mm": [
      [
        118.5,
        3.5
      ],
      [
        108.6,
        3.5
      ],
      [
        98.8,
        3.5
      ],
      [
        88.9,
        3.5
      ],
      [
        79.0,
        3.5
      ],
      [
        69.2,
        3.5
      ],
      [
        59.3,
        3.5
      ],
      [
        49.4,
        3.5
      ],
      [
        39.6,
        3.5
      ],
      [
        29.7,
        3.5
      ],
      [
        19.8,
        3.5
      ],
      [
        10.0,
        3.5
      ],
      [
        3.5,
        6.9
      ],
      [
        3.5,
        16.8
      ],
      [
        3.5,
        26.6
      ],
      [
        3.5,
        36.5
      ],
      [
        3.5,
        46.4
      ],
      [
        3.5,
        56.2
      ],
      [
        3.5,
        66.1
      ],
      [
        10.0,
        69.5
      ],
      [
        19.8,
        69.5
      ],
      [
        29.7,
        69.5
      ],
      [
        39.6,
        69.5
      ],
      [
        49.4,
        69.5
      ],
      [
        59.3,
        69.5
      ],
      [
        69.2,
        69.5
      ],
      [
        79.0,
        69.5
      ],
      [
        88.9,
        69.5
      ],
      [
        98.8,
        69.5
      ],
      [
        108.6,
        69.5
      ],
      [
        118.5,
        69.5
      ],
      [
        128.4,
        69.5
      ],
      [
        138.2,
        69.5
      ],
      [
        148.1,
        69.5
      ],
      [
        158.0,
        69.5
      ],
      [
        167.8,
        69.5
      ],
      [
        177.7,
        69.5
      ],
      [
        187.6,
        69.5
      ],
      [
        197.4,
        69.5
      ],
      [
        207.3,
        69.5
      ],
      [
        217.2,
        69.5
      ],
      [
        227.0,
        69.5
      ],
      [
        233.5,
        66.1
      ],
      [
        233.5,
        56.2
      ],
      [
        233.5,
        46.4
      ],
      [
        233.5,
        36.5
      ],
      [
        233.5,
        26.6
      ],
      [
        233.5,
        16.8
      ],
      [
        233.5,
        6.9
      ],
      [
        227.0,
        3.5
      ],
      [
        217.2,
        3.5
      ],
      [
        207.3,
        3.5
      ],
      [
        197.4,
        3.5
      ],
      [
        187.6,
        3.5
      ],
      [
        177.7,
        3.5
      ],
      [
        167.8,
        3.5
      ],
      [
        158.0,
        3.5
      ],
      [
        148.1,
        3.5
      ],
      [
        138.2,
        3.5
      ],
      [
        128.4,
        3.5
      ]
    ],
    "direction": "Measured: LED 1 at the top centre, running counter-clockwise (first towards the left); power connector at the top right.",
    "approximate": true
  },
  "display": {
    "width_px": 1920,
    "height_px": 480,
    "area_mm": {
      "x": 10.1,
      "y": 9.4,
      "w": 216.8,
      "h": 54.2
    }
  },
  "connection": {
    "type": "usb-controller",
    "notes": "USB (WinUSB), screen 1CBE:A088 and LED ring controller 0416:8050."
  },
  "usb": {
    "vid": "1cbe",
    "pid": "a088"
  },
  "sources": [
    {
      "url": "https://www.adorama.com/lian-li-8-inch-ips-lcd-universal-screen/p/lism088x",
      "note": "237 x 73 x 13 mm (bracket/unit), 8.8 inch, 1920 x 480 IPS"
    },
    {
      "url": "https://www.pccasegear.com/products/71065/lian-li-8-8in-universal-screen-black",
      "note": "retailer listing"
    }
  ],
  "verified_by": [
    "measured",
    "manufacturer"
  ],
  "notes": "Overall size 237 x 73 x 13 mm is listed by retailers for the unit. The active panel area is computed from the 8.8 inch diagonal at 4:1 (216.8 x 54.2 mm) and centred, so it is approximate. LED count 60, start position, direction and power connector position are measured on the owner's hardware; the ring positions are spread evenly along the inner border (approximate). The LED ring is a separate USB device (0416:8050)."
}
